{
  "version": 1,
  "id": "minimal-iso",
  "name": "Minimal ISO fixture",
  "unit": "u",
  "keys": [
    { "id": "ESC", "linux_keycode": 1, "x": 0, "y": 0, "w": 1, "h": 1 },
    { "id": "AE01", "linux_keycode": 2, "x": 1.5, "y": 0, "w": 1, "h": 1 },
    { "id": "TAB", "linux_keycode": 15, "x": 0, "y": 1, "w": 1.5, "h": 1 },
    { "id": "AD01", "linux_keycode": 16, "x": 1.5, "y": 1, "w": 1, "h": 1 },
    {
      "id": "RTRN",
      "linux_keycode": 28,
      "x": 12.25,
      "y": 1,
      "w": 1.5,
      "h": 2,
      "outline": [[0, 0], [1.5, 0], [1.5, 2], [0.25, 2], [0.25, 1], [0, 1]]
    },
    { "id": "LFSH", "linux_keycode": 42, "x": 0, "y": 2, "w": 1.25, "h": 1 },
    { "id": "LSGT", "linux_keycode": 86, "x": 1.25, "y": 2, "w": 1, "h": 1 }
  ],
  "groups": [
    { "id": "main", "key_ids": ["ESC", "AE01", "TAB", "AD01", "RTRN", "LFSH", "LSGT"] }
  ]
}
